[
  {
    "record_id": "SYN-CAL-0001",
    "scenario_id": "S03",
    "scenario_name": "Evenimente de securitate cu severitate ridicată",
    "source": "synthetic",
    "partition": "calibration",
    "timestamp": "2026-10-06T15:52:00+00:00",
    "target_user": "u_ion.55",
    "target_host": "WS-CONTAB01.CORP.CYBERLAB.LOCAL",
    "account_role": "standard_user",
    "maintenance_window": false,
    "auth_frequency": 43.5,
    "behavior_deviation": 65.5,
    "event_severity": 78.2,
    "access_scope": 39.0,
    "ground_truth": "suspicious",
    "has_missing_data": false,
    "missing_fields": [],
    "description": "Alerte de severitate mare din Wazuh/Sysmon (Kerberoasting, DCSync, Mimikatz)."
  },
  {
    "record_id": "SYN-CAL-0002",
    "scenario_id": "S01",
    "scenario_name": "Creștere neobișnuită a autentificărilor",
    "source": "synthetic",
    "partition": "calibration",
    "timestamp": "2026-10-02T22:11:00+00:00",
    "target_user": "u_ion.89",
    "target_host": "WS-CONTAB01.CORP.CYBERLAB.LOCAL",
    "account_role": "standard_user",
    "maintenance_window": false,
    "auth_frequency": 86.7,
    "behavior_deviation": 78.4,
    "event_severity": 41.0,
    "access_scope": 37.7,
    "ground_truth": "suspicious",
    "has_missing_data": false,
    "missing_fields": [],
    "description": "Spike brusc de autentificări pe un cont (posibil password spray sau brute-force)."
  },
  {
    "record_id": "SYN-CAL-0003",
    "scenario_id": "S03",
    "scenario_name": "Evenimente de securitate cu severitate ridicată",
    "source": "synthetic",
    "partition": "calibration",
    "timestamp": "2026-10-06T18:46:00+00:00",
    "target_user": "u_ion.42",
    "target_host": "WS-IT05.CORP.CYBERLAB.LOCAL",
    "account_role": "standard_user",
    "maintenance_window": false,
    "auth_frequency": 34.2,
    "behavior_deviation": 52.6,
    "event_severity": 94.1,
    "access_scope": 50.5,
    "ground_truth": "suspicious",
    "has_missing_data": false,
    "missing_fields": [],
    "description": "Alerte de severitate mare din Wazuh/Sysmon (Kerberoasting, DCSync, Mimikatz)."
  },
  {
    "record_id": "SYN-CAL-0004",
    "scenario_id": "N01",
    "scenario_name": "Autentificare normală",
    "source": "synthetic",
    "partition": "calibration",
    "timestamp": "2026-10-01T20:50:00+00:00",
    "target_user": "u_ion.51",
    "target_host": "SRV-FILE01.CORP.CYBERLAB.LOCAL",
    "account_role": "standard_user",
    "maintenance_window": false,
    "auth_frequency": 18.2,
    "behavior_deviation": 17.6,
    "event_severity": 4.8,
    "access_scope": 11.4,
    "ground_truth": "normal",
    "has_missing_data": false,
    "missing_fields": [],
    "description": "Utilizator standard pe stația obișnuită, acces la resurse autorizate."
  },
  {
    "record_id": "SYN-CAL-0005",
    "scenario_id": "N01",
    "scenario_name": "Autentificare normală",
    "source": "synthetic",
    "partition": "calibration",
    "timestamp": "2026-10-02T15:50:00+00:00",
    "target_user": "u_ion.48",
    "target_host": "SRV-FILE01.CORP.CYBERLAB.LOCAL",
    "account_role": "standard_user",
    "maintenance_window": false,
    "auth_frequency": 11.9,
    "behavior_deviation": 11.6,
    "event_severity": 8.2,
    "access_scope": 16.7,
    "ground_truth": "normal",
    "has_missing_data": false,
    "missing_fields": [],
    "description": "Utilizator standard pe stația obișnuită, acces la resurse autorizate."
  },
  {
    "record_id": "SYN-CAL-0006",
    "scenario_id": "N02",
    "scenario_name": "Activitate administrativă legitimă",
    "source": "synthetic",
    "partition": "calibration",
    "timestamp": "2026-10-06T20:12:00+00:00",
    "target_user": "sup_ana.51",
    "target_host": "SRV-FILE01.CORP.CYBERLAB.LOCAL",
    "account_role": "workstation_support",
    "maintenance_window": false,
    "auth_frequency": 49.0,
    "behavior_deviation": 14.9,
    "event_severity": 12.7,
    "access_scope": 74.5,
    "ground_truth": "normal",
    "has_missing_data": false,
    "missing_fields": [],
    "description": "Administrator domeniu care accesează multiple sisteme în cadrul atribuțiilor."
  },
  {
    "record_id": "SYN-CAL-0007",
    "scenario_id": "S03",
    "scenario_name": "Evenimente de securitate cu severitate ridicată",
    "source": "synthetic",
    "partition": "calibration",
    "timestamp": "2026-10-04T15:09:00+00:00",
    "target_user": "adm_vlad.17",
    "target_host": "SRV-FILE01.CORP.CYBERLAB.LOCAL",
    "account_role": "domain_admin",
    "maintenance_window": false,
    "auth_frequency": 29.6,
    "behavior_deviation": 55.8,
    "event_severity": 95.5,
    "access_scope": 43.3,
    "ground_truth": "suspicious",
    "has_missing_data": false,
    "missing_fields": [],
    "description": "Alerte de severitate mare din Wazuh/Sysmon (Kerberoasting, DCSync, Mimikatz)."
  },
  {
    "record_id": "SYN-CAL-0008",
    "scenario_id": "S02",
    "scenario_name": "Acces neobișnuit la mai multe endpoint-uri",
    "source": "synthetic",
    "partition": "calibration",
    "timestamp": "2026-10-02T20:03:00+00:00",
    "target_user": "svc_sql_98",
    "target_host": "DC01.CORP.CYBERLAB.LOCAL",
    "account_role": "service_account",
    "maintenance_window": false,
    "auth_frequency": 47.7,
    "behavior_deviation": 84.8,
    "event_severity": 35.2,
    "access_scope": 81.2,
    "ground_truth": "suspicious",
    "has_missing_data": false,
    "missing_fields": [],
    "description": "Cont care accesează sisteme dinafara profilului său normal (mișcare laterală)."
  },
  {
    "record_id": "SYN-CAL-0009",
    "scenario_id": "N01",
    "scenario_name": "Autentificare normală",
    "source": "synthetic",
    "partition": "calibration",
    "timestamp": "2026-10-08T07:20:00+00:00",
    "target_user": "u_ion.69",
    "target_host": "WS-IT05.CORP.CYBERLAB.LOCAL",
    "account_role": "standard_user",
    "maintenance_window": false,
    "auth_frequency": 18.5,
    "behavior_deviation": 9.6,
    "event_severity": 8.1,
    "access_scope": 11.9,
    "ground_truth": "normal",
    "has_missing_data": false,
    "missing_fields": [],
    "description": "Utilizator standard pe stația obișnuită, acces la resurse autorizate."
  },
  {
    "record_id": "SYN-CAL-0010",
    "scenario_id": "S03",
    "scenario_name": "Evenimente de securitate cu severitate ridicată",
    "source": "synthetic",
    "partition": "calibration",
    "timestamp": "2026-10-07T15:18:00+00:00",
    "target_user": "adm_vlad.54",
    "target_host": "DC01.CORP.CYBERLAB.LOCAL",
    "account_role": "domain_admin",
    "maintenance_window": false,
    "auth_frequency": 32.4,
    "behavior_deviation": 54.9,
    "event_severity": 82.0,
    "access_scope": 56.9,
    "ground_truth": "suspicious",
    "has_missing_data": false,
    "missing_fields": [],
    "description": "Alerte de severitate mare din Wazuh/Sysmon (Kerberoasting, DCSync, Mimikatz)."
  },
  {
    "record_id": "SYN-CAL-0011",
    "scenario_id": "S02",
    "scenario_name": "Acces neobișnuit la mai multe endpoint-uri",
    "source": "synthetic",
    "partition": "calibration",
    "timestamp": "2026-10-03T17:33:00+00:00",
    "target_user": "u_ion.20",
    "target_host": "WS-IT05.CORP.CYBERLAB.LOCAL",
    "account_role": "standard_user",
    "maintenance_window": false,
    "auth_frequency": 41.2,
    "behavior_deviation": 77.5,
    "event_severity": 37.4,
    "access_scope": 73.9,
    "ground_truth": "suspicious",
    "has_missing_data": false,
    "missing_fields": [],
    "description": "Cont care accesează sisteme dinafara profilului său normal (mișcare laterală)."
  },
  {
    "record_id": "SYN-CAL-0012",
    "scenario_id": "S04",
    "scenario_name": "Corelarea mai multor indicii",
    "source": "synthetic",
    "partition": "calibration",
    "timestamp": "2026-10-06T11:48:00+00:00",
    "target_user": "u_victima.34",
    "target_host": "WS-CONTAB01.CORP.CYBERLAB.LOCAL",
    "account_role": "compromised_user",
    "maintenance_window": false,
    "auth_frequency": 84.1,
    "behavior_deviation": 94.5,
    "event_severity": 88.2,
    "access_scope": 89.7,
    "ground_truth": "suspicious",
    "has_missing_data": false,
    "missing_fields": [],
    "description": "Atac activ combinat: frecvență mare, abatere severă, alerte critice și acces larg."
  },
  {
    "record_id": "SYN-CAL-0013",
    "scenario_id": "S04",
    "scenario_name": "Corelarea mai multor indicii",
    "source": "synthetic",
    "partition": "calibration",
    "timestamp": "2026-10-01T11:17:00+00:00",
    "target_user": "adm_vlad.77",
    "target_host": "WS-IT05.CORP.CYBERLAB.LOCAL",
    "account_role": "domain_admin",
    "maintenance_window": false,
    "auth_frequency": 77.4,
    "behavior_deviation": 90.2,
    "event_severity": 91.2,
    "access_scope": 83.0,
    "ground_truth": "suspicious",
    "has_missing_data": false,
    "missing_fields": [],
    "description": "Atac activ combinat: frecvență mare, abatere severă, alerte critice și acces larg."
  },
  {
    "record_id": "SYN-CAL-0014",
    "scenario_id": "S01",
    "scenario_name": "Creștere neobișnuită a autentificărilor",
    "source": "synthetic",
    "partition": "calibration",
    "timestamp": "2026-10-02T14:09:00+00:00",
    "target_user": "svc_sql_53",
    "target_host": "WS-HR02.CORP.CYBERLAB.LOCAL",
    "account_role": "service_account",
    "maintenance_window": false,
    "auth_frequency": 91.6,
    "behavior_deviation": 76.6,
    "event_severity": 23.8,
    "access_scope": 35.4,
    "ground_truth": "suspicious",
    "has_missing_data": false,
    "missing_fields": [],
    "description": "Spike brusc de autentificări pe un cont (posibil password spray sau brute-force)."
  },
  {
    "record_id": "SYN-CAL-0015",
    "scenario_id": "N01",
    "scenario_name": "Autentificare normală",
    "source": "synthetic",
    "partition": "calibration",
    "timestamp": "2026-10-03T15:25:00+00:00",
    "target_user": "u_ion.64",
    "target_host": "SQL-PROD01.CORP.CYBERLAB.LOCAL",